{
  "id": "lesson.b2.20.05",
  "title": "Selección estilística entre pasivas",
  "level": "B2",
  "goal": "Select with stylistic mastery between reflexive passives, analytical passives with 'ser', and resultative passives with 'estar'.",
  "grammar": "criterios de selección y alternancia estilística entre pasiva refleja, analítica y de estado",
  "sections": [
    {
      "type": "goal",
      "items": [
        "Evaluate stylistic naturalness across different passive structures.",
        "Alternate passive types to avoid repetitive Germanic passive calques.",
        "Produce balanced, elegant formal prose adhering to CEFR B2 house style."
      ]
    },
    {
      "type": "recycle",
      "count": 3
    },
    {
      "type": "grammar",
      "ref": "grammar/b2/b2-20-05-a-gr.json"
    },
    {
      "type": "vocabulary",
      "ref": "vocabulary/b2/b2-20-05-voc.json"
    },
    {
      "type": "exercise-group",
      "title": "Practice",
      "ref": "exercises/b2/b2-20-05-ex.json",
      "exerciseRefs": [
        "b2-20-05.ex01",
        "b2-20-05.ex02",
        "b2-20-05.ex03",
        "b2-20-05.ex04"
      ]
    },
    {
      "type": "exercise-group",
      "title": "Dialogue",
      "ref": "exercises/b2/b2-20-05-ex.json",
      "exerciseRefs": [
        "b2-20-05.ex05"
      ]
    },
    {
      "type": "exercise-group",
      "title": "Listening",
      "ref": "exercises/b2/b2-20-05-ex.json",
      "exerciseRefs": [
        "b2-20-05.ex06"
      ]
    }
  ]
}
