{
  "id": "lesson.b2.futuro.04",
  "title": "Relativos formales y precisión unívoca en tratados de cooperación",
  "level": "B2",
  "sections": [
    {
      "type": "story",
      "ref": "stories/world/b2/b2-futuro-04.json"
    },
    {
      "type": "grammar",
      "ref": "grammar/b2/b2-futuro-04-a-gr.json"
    },
    {
      "type": "vocabulary",
      "ref": "vocabulary/b2/b2-futuro-04-voc.json"
    },
    {
      "type": "exercise-group",
      "title": "Practice",
      "ref": "exercises/b2/b2-futuro-04-ex.json",
      "exerciseRefs": [
        "b2-futuro-04.ex01",
        "b2-futuro-04.ex02",
        "b2-futuro-04.ex03",
        "b2-futuro-04.ex04"
      ]
    }
  ]
}