{
  "id": "lesson.b1.06.05",
  "title": "Professional Communication",
  "level": "B1",
  "goal": "Communicate professionally about requests and limitations.",
  "grammar": "Professional Communication",
  "sections": [
    {
      "type": "goal",
      "items": [
        "Communicate professionally about requests and limitations.",
        "Give reasons for refusals and propose alternatives.",
        "Understand an adapted extract from Bartleby, the Scrivener.",
        "Use three new professional communication words."
      ]
    },
    {
      "type": "recycle",
      "count": 3
    },
    {
      "type": "grammar",
      "ref": "grammar/b1/b1-06-05-professional-communication-gr.json"
    },
    {
      "type": "vocabulary",
      "ref": "vocabulary/b1/b1-06-05-voc.json"
    },
    {
      "type": "exercise-group",
      "title": "Practice",
      "ref": "exercises/b1/b1-06-05-ex.json",
      "exerciseRefs": [
        "b1-06-05.ex01",
        "b1-06-05.ex02",
        "b1-06-05.ex03",
        "b1-06-05.ex04",
        "b1-06-05.ex05",
        "b1-06-05.ex06",
        "b1-06-05.ex07",
        "b1-06-05.ex08"
      ]
    },
    {
      "type": "story",
      "ref": "stories/classics/b1/b1-06.json"
    },
    {
      "type": "exercise-group",
      "title": "Reading",
      "ref": "exercises/b1/b1-06-05-ex.json",
      "exerciseRefs": [
        "b1-06-05.ex09",
        "b1-06-05.ex10",
        "b1-06-05.ex11",
        "b1-06-05.ex12"
      ]
    },
    {
      "type": "exercise-group",
      "title": "Listening",
      "ref": "exercises/b1/b1-06-05-ex.json",
      "exerciseRefs": [
        "b1-06-05.ex13",
        "b1-06-05.ex14"
      ]
    },
    {
      "type": "exercise-group",
      "title": "Dialogue",
      "ref": "exercises/b1/b1-06-05-ex.json",
      "exerciseRefs": [
        "b1-06-05.ex15",
        "b1-06-05.ex16",
        "b1-06-05.ex17"
      ]
    },
    {
      "type": "exercise-group",
      "title": "Writing",
      "ref": "exercises/b1/b1-06-05-ex.json",
      "exerciseRefs": [
        "b1-06-05.ex18",
        "b1-06-05.ex19"
      ]
    },
    {
      "type": "srs"
    },
    {
      "type": "checklist",
      "items": [
        "I can communicate professionally about requests and limitations.",
        "I can give reasons for refusals and propose alternatives.",
        "I can understand an adapted extract from Bartleby, the Scrivener.",
        "I can use three new professional communication words."
      ]
    }
  ]
}
