{
  "id": "lesson.b2.argentinaba.04",
  "title": "La pasión por el psicoanálisis, los cafés y las librerías",
  "level": "B2",
  "sections": [
    {
      "type": "story",
      "ref": "stories/world/b2/b2-argentinaba-04.json"
    },
    {
      "type": "grammar",
      "ref": "grammar/b2/b2-argentinaba-04-a-gr.json"
    },
    {
      "type": "vocabulary",
      "ref": "vocabulary/b2/b2-argentinaba-04-voc.json"
    },
    {
      "type": "exercise-group",
      "title": "Practice",
      "ref": "exercises/b2/b2-argentinaba-04-ex.json",
      "exerciseRefs": [
        "b2-argentinaba-04.ex01",
        "b2-argentinaba-04.ex02",
        "b2-argentinaba-04.ex03",
        "b2-argentinaba-04.ex04",
        "b2-argentinaba-04.ex05",
        "b2-argentinaba-04.ex06"
      ]
    }
  ]
}
