{
  "id": "lesson.b1.conquista.05",
  "title": "¿Conquista o catástrofe?",
  "level": "B1",
  "goal": "Read why most conquest accounts were written by the winning side, meet the scholar who gathered rare indigenous testimony, and learn why historians reject both the 'black' and 'white' legends.",
  "grammar": "Interpretación histórica",
  "sections": [
    {
      "type": "goal",
      "items": [
        "Explain why written sources on the conquest are so one-sided.",
        "Explain who compiled and translated the few surviving indigenous testimonies of the conquest.",
        "Explain what today's historians think of the 'white legend' and 'black legend'.",
        "Explain why some historians distinguish 'conquest' from 'catastrophe'.",
        "Use passive voice to describe how historical sources and interpretations were produced."
      ]
    },
    {
      "type": "recycle",
      "count": 3
    },
    {
      "type": "story",
      "ref": "stories/world/b1/b1-conquista-05-catastrofe.json"
    },
    {
      "type": "vocabulary",
      "ref": "vocabulary/b1/b1-conquista-05-voc.json"
    },
    {
      "type": "grammar",
      "ref": "grammar/b1/b1-conquista-05-voz-pasiva-fuentes-gr.json"
    },
    {
      "type": "exercise-group",
      "title": "Practice",
      "ref": "exercises/b1/b1-conquista-05-ex.json",
      "exerciseRefs": [
        "b1-conquista-05.ex01",
        "b1-conquista-05.ex01b",
        "b1-conquista-05.ex02",
        "b1-conquista-05.ex03",
        "b1-conquista-05.ex04",
        "b1-conquista-05.ex05",
        "b1-conquista-05.ex06",
        "b1-conquista-05.ex07",
        "b1-conquista-05.ex08"
      ]
    },
    {
      "type": "srs"
    },
    {
      "type": "checklist",
      "items": [
        "I can explain why written sources on the conquest are so one-sided.",
        "I can explain who compiled and translated the few surviving indigenous testimonies of the conquest.",
        "I can explain what today's historians think of the 'white legend' and 'black legend'.",
        "I can explain why some historians distinguish 'conquest' from 'catastrophe'.",
        "I can use passive voice to describe how historical sources and interpretations were produced."
      ]
    }
  ]
}
