{
  "id": "lesson.b2.argentinaregiones.consolidation",
  "title": "Consolidación: El vasto mapa argentino",
  "level": "B2",
  "sections": [
    {
      "type": "goal",
      "items": [
        "Integrar la visión geográfica, humana y cultural de los diversos terruños y regiones argentinas.",
        "Consolidar el léxico especializado de la pampa, la vitivinicultura andina, el noroeste prehispánico y la Patagonia austral.",
        "Dominar el repertorio de estructuras concesivas cultas (si bien, aun cuando, conectores parentéticos, pese a, por + adj + que)."
      ]
    },
    {
      "type": "recycle",
      "count": 3
    },
    {
      "type": "story",
      "ref": "stories/world/b2/b2-argentinaregiones-consolidation.json"
    },
    {
      "type": "exercise-group",
      "title": "Review",
      "ref": "exercises/b2/b2-argentinaregiones-consolidation-ex.json",
      "exerciseRefs": [
        "b2-argentinaregiones-consolidation.ex01",
        "b2-argentinaregiones-consolidation.ex02",
        "b2-argentinaregiones-consolidation.ex03",
        "b2-argentinaregiones-consolidation.ex04",
        "b2-argentinaregiones-consolidation.ex05",
        "b2-argentinaregiones-consolidation.ex06",
        "b2-argentinaregiones-consolidation.ex07",
        "b2-argentinaregiones-consolidation.ex08"
      ]
    },
    {
      "type": "checklist",
      "items": [
        "Reconozco la trascendencia del mito gaucho y su evolución poética desde el Martín Fierro.",
        "Comprendo la ingeniería hidráulica de las acequias mendocinas y el éxito del Malbec de altura.",
        "Identifico la riqueza geológica y el sincretismo andino de la Quebrada de Humahuaca y los Valles Calchaquíes.",
        "Analizo la dinámica glaciológica del Perito Moreno y la gesta comunitaria de los colonos galeses en Chubut.",
        "Comprendo el drama histórico de los pueblos fueguinos y el rol estratégico de Ushuaia como enclave antártico.",
        "Aplico con precisión las diferentes estructuras concesivas según el grado de factualidad e hipótesis requeridos."
      ]
    }
  ]
}
