{
  "id": "lesson.b1.centroamerica.01",
  "title": "Nicaragua",
  "level": "B1",
  "goal": "Read how the Somoza dynasty in Nicaragua was overthrown in 1979 by the Sandinista Front, which then faced the difficult task of governing a country devastated by war.",
  "grammar": "Una vez que: marcar el punto de partida de algo nuevo",
  "sections": [
    {
      "type": "goal",
      "items": [
        "Explain which elites, allied with US companies, backed dynasties like the Somozas.",
        "Describe how dynasties and juntas stayed in power through fraud and assassination.",
        "State when the Somoza regime was overthrown.",
        "Describe the new government's early reforms.",
        "Use una vez que to mark a new starting point."
      ]
    },
    {
      "type": "recycle",
      "count": 3
    },
    {
      "type": "story",
      "ref": "stories/world/b1/b1-centroamerica-01-nicaragua.json"
    },
    {
      "type": "vocabulary",
      "ref": "vocabulary/b1/b1-centroamerica-01-voc.json"
    },
    {
      "type": "grammar",
      "ref": "grammar/b1/b1-centroamerica-01-una-vez-que-gr.json"
    },
    {
      "type": "exercise-group",
      "title": "Practice",
      "ref": "exercises/b1/b1-centroamerica-01-ex.json",
      "exerciseRefs": [
        "b1-centroamerica-01.ex01",
        "b1-centroamerica-01.ex01b",
        "b1-centroamerica-01.ex02",
        "b1-centroamerica-01.ex03",
        "b1-centroamerica-01.ex04",
        "b1-centroamerica-01.ex05",
        "b1-centroamerica-01.ex06",
        "b1-centroamerica-01.ex07",
        "b1-centroamerica-01.ex08"
      ]
    },
    {
      "type": "srs"
    },
    {
      "type": "checklist",
      "items": [
        "I can explain which elites, allied with US companies, backed dynasties like the Somozas.",
        "I can describe how dynasties and juntas stayed in power through fraud and assassination.",
        "I can state when the Somoza regime was overthrown.",
        "I can describe the new government's early reforms.",
        "I can use una vez que to mark a new starting point."
      ]
    }
  ]
}
