{
  "id": "lesson.b1.precolombina.01",
  "title": "Un continente antes de Europa",
  "level": "B1",
  "goal": "Read a continent-wide picture of the Americas before 1492, and talk about who lived there and what came before the Maya, Mexica and Inca.",
  "grammar": "Conectores formales",
  "sections": [
    {
      "type": "intro",
      "title": "Welcome to Latin America",
      "body": [
        "This is a 36-unit track on the history of Latin America, from the civilisations that flourished long before 1492 to the turn of the twenty-first century: conquest and colonial life, independence and the new republics, revolution, dictatorship, and the return of democracy.",
        "Every lesson is built around a story: a real episode told as a narrative, not a list of dates to memorise. The words you need come from that story, and so does one B1 grammar point, practised on the same topic. Each unit has five lessons, then a consolidation lesson that ties them together.",
        "This track runs alongside Core Spanish, not instead of it. It doesn't gate your level test, but it assumes you're working through B1 Core grammar at the same time, and every word you learn here goes into the same review deck.",
        "Okay, let's begin before Europe arrived."
      ]
    },
    {
      "type": "goal",
      "items": [
        "Explain why nobody knows exactly how many people lived in the Americas before 1492.",
        "Explain that influential civilisations had already developed long before the Maya, Mexica and Inca.",
        "Describe how the first inhabitants reached the Americas across Beringia.",
        "Explain where maize and the potato were each domesticated.",
        "Use formal connectors like 'a lo largo de' and 'mientras que'."
      ]
    },
    {
      "type": "recycle",
      "count": 3
    },
    {
      "type": "story",
      "ref": "stories/world/b1/b1-precolombina-01-continente.json"
    },
    {
      "type": "vocabulary",
      "ref": "vocabulary/b1/b1-precolombina-01-voc.json"
    },
    {
      "type": "grammar",
      "ref": "grammar/b1/b1-precolombina-01-geography-connectors-gr.json"
    },
    {
      "type": "exercise-group",
      "title": "Practice",
      "ref": "exercises/b1/b1-precolombina-01-ex.json",
      "exerciseRefs": [
        "b1-precolombina-01.ex01",
        "b1-precolombina-01.ex01b",
        "b1-precolombina-01.ex02",
        "b1-precolombina-01.ex03",
        "b1-precolombina-01.ex04",
        "b1-precolombina-01.ex05",
        "b1-precolombina-01.ex06",
        "b1-precolombina-01.ex07",
        "b1-precolombina-01.ex08"
      ]
    },
    {
      "type": "srs"
    },
    {
      "type": "checklist",
      "items": [
        "I can explain why nobody knows exactly how many people lived in the Americas before 1492.",
        "I can explain that influential civilisations had already developed long before the Maya, Mexica and Inca.",
        "I can describe how the first inhabitants reached the Americas across Beringia.",
        "I can explain where maize and the potato were each domesticated.",
        "I can use formal connectors like 'a lo largo de' and 'mientras que'."
      ]
    }
  ]
}
