{
  "id": "lesson.b2.20.01",
  "title": "Voz pasiva analítica con ser y participio",
  "level": "B2",
  "goal": "Master analytical passive sentences with 'ser + participio' and enforce strict gender and number agreement with the subject patient.",
  "grammar": "voz pasiva analítica con ser y concordancia de género y número del participio",
  "sections": [
    {
      "type": "goal",
      "items": [
        "Construct analytical passive sentences with 'ser' in various tenses.",
        "Ensure gender and number agreement of past participles with subject patients.",
        "Identify contexts where the analytical passive is preferred over active voice."
      ]
    },
    {
      "type": "recycle",
      "count": 3
    },
    {
      "type": "grammar",
      "ref": "grammar/b2/b2-20-01-a-gr.json"
    },
    {
      "type": "vocabulary",
      "ref": "vocabulary/b2/b2-20-01-voc.json"
    },
    {
      "type": "exercise-group",
      "title": "Practice",
      "ref": "exercises/b2/b2-20-01-ex.json",
      "exerciseRefs": [
        "b2-20-01.ex01",
        "b2-20-01.ex02",
        "b2-20-01.ex03",
        "b2-20-01.ex04"
      ]
    },
    {
      "type": "exercise-group",
      "title": "Dialogue",
      "ref": "exercises/b2/b2-20-01-ex.json",
      "exerciseRefs": [
        "b2-20-01.ex05"
      ]
    },
    {
      "type": "exercise-group",
      "title": "Listening",
      "ref": "exercises/b2/b2-20-01-ex.json",
      "exerciseRefs": [
        "b2-20-01.ex06"
      ]
    }
  ]
}
