{
  "id": "lesson.b2.31.05",
  "title": "Causa-efecto subjetiva: justificación y énfasis",
  "level": "B2",
  "sections": [
    {
      "type": "story",
      "ref": "stories/classics/b2/b2-31.json"
    },
    {
      "type": "grammar",
      "ref": "grammar/b2/b2-31-05-a-gr.json"
    },
    {
      "type": "vocabulary",
      "ref": "vocabulary/b2/b2-31-05-voc.json"
    },
    {
      "type": "exercise-group",
      "title": "Practice",
      "ref": "exercises/b2/b2-31-05-ex.json",
      "exerciseRefs": [
        "b2-31-05.ex01",
        "b2-31-05.ex02",
        "b2-31-05.ex03",
        "b2-31-05.ex04"
      ]
    }
  ]
}