{
  "id": "lesson.b2.29.04",
  "title": "Recapitulative Paraphrase: dicho en otros términos, en otras palabras",
  "level": "B2",
  "sections": [
    {
      "type": "story",
      "ref": "stories/classics/b2/b2-29.json"
    },
    {
      "type": "grammar",
      "ref": "grammar/b2/b2-29-04-a-gr.json"
    },
    {
      "type": "vocabulary",
      "ref": "vocabulary/b2/b2-29-04-voc.json"
    },
    {
      "type": "exercise-group",
      "title": "Practice",
      "ref": "exercises/b2/b2-29-04-ex.json",
      "exerciseRefs": [
        "b2-29-04.ex01",
        "b2-29-04.ex02",
        "b2-29-04.ex03",
        "b2-29-04.ex04",
        "b2-29-04.ex05",
        "b2-29-04.ex06"
      ]
    }
  ]
}
